{
  "slug": "curso-exemplo",
  "type": "courses",
  "name": "Primeiros passos com C#",
  "summary": "Um curso fictício para demonstrar a descoberta de recursos de aprendizado.",
  "description": "Um curso fictício para demonstrar a descoberta de recursos de aprendizado. Este cadastro é apenas uma demonstração da plataforma, sem vínculo com uma organização ou pessoa real.",
  "url": "https://example.org/curso-exemplo",
  "areas": ["backend", "educacao"],
  "technologies": ["csharp", "dotnet"],
  "languages": ["pt-BR"],
  "updatedAt": "2026-10-01",
  "demo": true
}
