{
  "slug": "criador-exemplo",
  "type": "creators",
  "name": "Pessoa Criadora — exemplo",
  "summary": "Um perfil fictício para demonstrar como descobrir criadores de conteúdo.",
  "description": "Um perfil fictício para demonstrar como descobrir criadores de conteúdo. Este cadastro é apenas uma demonstração da plataforma, sem vínculo com uma organização ou pessoa real.",
  "url": "https://example.org/criador-exemplo",
  "areas": ["design", "produto"],
  "technologies": ["figma"],
  "languages": ["pt-BR"],
  "updatedAt": "2026-10-01",
  "demo": true
}
