{
  "slug": "comunidade-exemplo",
  "type": "communities",
  "name": "Comunidade Horizonte",
  "summary": "Um espaço fictício para trocar experiências sobre tecnologia e carreira.",
  "description": "Um espaço fictício para trocar experiências sobre tecnologia e carreira. Este cadastro é apenas uma demonstração da plataforma, sem vínculo com uma organização ou pessoa real.",
  "url": "https://example.org/comunidade-exemplo",
  "areas": ["carreira", "frontend"],
  "technologies": ["react"],
  "languages": ["pt-BR"],
  "updatedAt": "2026-10-01",
  "demo": true
}
