{
  "slug": "roadmap-exemplo",
  "type": "roadmaps",
  "name": "Seu caminho em dados",
  "summary": "Um roteiro fictício para organizar os primeiros estudos na área de dados.",
  "description": "Um roteiro fictício para organizar os primeiros estudos na área de dados. Este cadastro é apenas uma demonstração da plataforma, sem vínculo com uma organização ou pessoa real.",
  "url": "https://example.org/roadmap-exemplo",
  "areas": ["dados"],
  "technologies": ["python"],
  "languages": ["pt-BR"],
  "updatedAt": "2026-10-01",
  "demo": true
}
