{
  "slug": "canal-exemplo",
  "type": "youtube",
  "name": "Tecnologia em Conversa",
  "summary": "Um canal fictício para explorar segurança, infraestrutura e redes.",
  "description": "Um canal fictício para explorar segurança, infraestrutura e redes. Este cadastro é apenas uma demonstração da plataforma, sem vínculo com uma organização ou pessoa real.",
  "url": "https://example.org/canal-exemplo",
  "areas": ["cybersecurity", "redes"],
  "technologies": ["linux"],
  "languages": ["pt-BR"],
  "updatedAt": "2026-10-01",
  "demo": true
}
